{
  "manifest_version": "1.0",
  "system_name": "ai-business-platform",
  "description": "Full-stack AI business platform with CRM, financial analytics, and agent orchestration",
  "org": "Infinity-X-One-Systems",
  "version": "0.1.0",
  "components": {
    "backend": {
      "template": "fastapi",
      "config": {
        "service_name": "ai-business-api",
        "port": 8000,
        "workers": 4
      }
    },
    "frontend": {
      "template": "nextjs-pwa",
      "pwa": true,
      "config": {
        "app_name": "AI Business Platform",
        "theme_color": "#6366f1"
      }
    },
    "ai_agents": [
      {
        "template": "research",
        "instance_name": "market-researcher",
        "config": { "max_sources": 20, "depth": 3 }
      },
      {
        "template": "financial",
        "instance_name": "financial-analyzer",
        "config": { "timeframes": ["1D", "1W"] }
      },
      {
        "template": "orchestrator",
        "instance_name": "workflow-orchestrator"
      }
    ],
    "business": {
      "template": "crm",
      "config": { "pipeline_stages": ["lead", "qualified", "proposal", "closed"] }
    },
    "infrastructure": {
      "docker": true,
      "kubernetes": false,
      "github_actions": true,
      "github_pages": true,
      "github_projects": true,
      "observability": false
    },
    "governance": {
      "tap_enforcement": true,
      "test_coverage_gate": true,
      "security_scan": true,
      "memory_consistency": true
    }
  },
  "memory": {
    "backend": "redis",
    "ttl_seconds": 7200,
    "max_facts": 200
  },
  "integrations": {
    "mobile_api": true,
    "openai_compatible": true,
    "webhook_dispatch": true,
    "cors_origins": [
      "https://infinityxai.com",
      "https://vizual-x.com",
      "https://app.example.com"
    ]
  },
  "metadata": {
    "created_by": "infinity-orchestrator",
    "created_at": "2026-02-20T04:00:00Z",
    "tags": ["ai", "business", "crm", "financial"]
  }
}
